{
  "id": "article-1001",
  "locale": "en",
  "kind": "article",
  "status": "published",
  "visibility": "public",
  "slug": "hello-from-codex",
  "title": "Hello from Codex",
  "content": "One entry contract, many adapters.",
  "metadata": {
    "source_id": {
      "value": "fixture-1001"
    },
    "source_sequence": {
      "value": 9007199254740991
    },
    "operator_note": {
      "value": "schema-sensitive fixture metadata"
    }
  },
  "terms": [
    {
      "taxonomy": "topic",
      "term_id": "architecture"
    }
  ],
  "version": 1,
  "created_at": "2026-09-09T12:00:00Z",
  "updated_at": "2026-09-09T12:00:00Z",
  "published_at": "2026-09-09T12:00:00Z"
}
